{
  "schema_version": "4.0",
  "case_id": "case001-v2",
  "source_id": "src-authored-order-csv",
  "family_id": "fam-authored-order-csv",
  "source_version": "1",
  "origin": {
    "kind": "locally_authored",
    "uri": null,
    "revision": null,
    "license": null,
    "unknown_reason": "Source explicitly says development sample; external provenance, author, revision and license were not supplied"
  },
  "document_file": "cases/case001/clean/source.md",
  "document_sha256": "089f741805a2230096d8ee2e01154ee381e02f6f7060078a698c642d43760e2a",
  "description": "Single-input order CSV deduplication and customer aggregation development procedure"
}
